00:40:19.343845 IP 109.200.209.32.50002 > 192.168.4.17.57488: UDP, length 52
00:40:19.960737 IP 192.168.4.17.57488 > 109.200.209.32.50002: UDP, length 60
00:40:20.252462 IP 142.251.32.98.443 > 192.168.4.4.49316: tcp 1418
00:40:20.252657 IP 142.251.32.98.443 > 192.168.4.4.49316: tcp 1418
00:40:20.252698 IP 142.251.32.98.443 > 192.168.4.4.49316: tcp 1418
00:40:20.253060 IP 142.251.32.98.443 > 192.168.4.4.49316: tcp 1418
00:40:20.253119 IP 142.251.32.98.443 > 192.168.4.4.49316: tcp 1418
00:40:20.253198 IP 142.251.32.98.443 > 192.168.4.4.49316: tcp 1418
00:40:20.253238 IP 142.251.32.98.443 > 192.168.4.4.49316: tcp 1418
00:40:20.253719 IP 142.251.32.98.443 > 192.168.4.4.49316: tcp 1418
00:40:20.253760 IP 142.251.32.98.443 > 192.168.4.4.49316: tcp 1321
00:40:20.254095 IP 142.251.32.98.443 > 192.168.4.4.49316: tcp 1418
00:40:20.254173 IP 142.251.32.98.443 > 192.168.4.4.49316: tcp 1418
00:40:20.254532 IP 142.251.32.98.443 > 192.168.4.4.49316: tcp 1418
00:40:20.254581 IP 142.251.32.98.443 > 192.168.4.4.49316: tcp 1418
00:40:20.254637 IP 142.251.32.98.443 > 192.168.4.4.49316: tcp 1418
00:40:20.254698 IP 142.251.32.98.443 > 192.168.4.4.49316: tcp 1418
00:40:20.254736 IP 142.251.32.98.443 > 192.168.4.4.49316: tcp 1418
00:40:20.255358 IP 142.251.32.98.443 > 192.168.4.4.49316: tcp 1403
00:40:20.283435 IP 142.251.32.98.443 > 192.168.4.4.49316: tcp 1403
00:40:20.343484 IP 109.200.209.32.50002 > 192.168.4.17.57488: UDP, length 52
00:40:20.370307 IP 192.168.4.4.49316 > 142.251.32.98.443: tcp 0
00:40:20.372335 IP 192.168.4.4.49316 > 142.251.32.98.443: tcp 0
00:40:20.372912 IP 192.168.4.4.49316 > 142.251.32.98.443: tcp 0
00:40:20.373000 IP 192.168.4.4.49316 > 142.251.32.98.443: tcp 0
00:40:20.373144 IP 192.168.4.4.49316 > 142.251.32.98.443: tcp 0
00:40:20.373276 IP 192.168.4.4.49316 > 142.251.32.98.443: tcp 0
00:40:20.373680 IP 192.168.4.4.49316 > 142.251.32.98.443: tcp 0
00:40:20.373765 IP 192.168.4.4.49316 > 142.251.32.98.443: tcp 0
00:40:20.373882 IP 192.168.4.4.49316 > 142.251.32.98.443: tcp 0
00:40:20.374186 IP 192.168.4.4.49316 > 142.251.32.98.443: tcp 0
00:40:20.409749 IP 192.168.4.17.57488 > 109.200.209.32.50002: UDP, length 8
00:40:20.416212 IP 109.200.209.32.50002 > 192.168.4.17.57488: UDP, length 8
00:40:20.597991 IP 142.251.32.98.443 > 192.168.4.4.49316: tcp 1418
00:40:20.676711 IP 192.168.4.4.49316 > 142.251.32.98.443: tcp 0
00:40:20.682668 IP 142.251.32.98.443 > 192.168.4.4.49316: tcp 1418
00:40:20.682842 IP 142.251.32.98.443 > 192.168.4.4.49316: tcp 1418
00:40:20.682900 IP 142.251.32.98.443 > 192.168.4.4.49316: tcp 1418
00:40:20.682939 IP 142.251.32.98.443 > 192.168.4.4.49316: tcp 1418
00:40:20.685186 IP 192.168.4.4.49316 > 142.251.32.98.443: tcp 0
00:40:20.686538 IP 192.168.4.4.49316 > 142.251.32.98.443: tcp 0
00:40:20.686930 IP 192.168.4.4.49316 > 142.251.32.98.443: tcp 0
00:40:20.687201 IP 192.168.4.4.49316 > 142.251.32.98.443: tcp 0
00:40:20.691713 IP 142.251.32.98.443 > 192.168.4.4.49316: tcp 1418
00:40:20.691789 IP 142.251.32.98.443 > 192.168.4.4.49316: tcp 1418
00:40:20.691910 IP 142.251.32.98.443 > 192.168.4.4.49316: tcp 1403
00:40:20.694001 IP 192.168.4.4.49316 > 142.251.32.98.443: tcp 0
00:40:20.695463 IP 192.168.4.4.49316 > 142.251.32.98.443: tcp 0
00:40:20.695848 IP 192.168.4.4.49316 > 142.251.32.98.443: tcp 0
00:40:20.696102 IP 192.168.4.4.49316 > 142.251.32.98.443: tcp 39
00:40:20.702234 IP 142.251.32.98.443 > 192.168.4.4.49316: tcp 0
00:40:20.781763 IP 192.168.4.4.49326 > 142.251.35.161.443: tcp 73
00:40:20.788005 IP 142.251.35.161.443 > 192.168.4.4.49326: tcp 131
00:40:20.788163 IP 142.251.35.161.443 > 192.168.4.4.49326: tcp 1418
00:40:20.788318 IP 142.251.35.161.443 > 192.168.4.4.49326: tcp 1418
00:40:20.788368 IP 142.251.35.161.443 > 192.168.4.4.49326: tcp 1418
00:40:20.788407 IP 142.251.35.161.443 > 192.168.4.4.49326: tcp 0
00:40:20.788770 IP 142.251.35.161.443 > 192.168.4.4.49326: tcp 1418
00:40:20.788837 IP 142.251.35.161.443 > 192.168.4.4.49326: tcp 1418
00:40:20.788886 IP 142.251.35.161.443 > 192.168.4.4.49326: tcp 1418
00:40:20.788924 IP 142.251.35.161.443 > 192.168.4.4.49326: tcp 1418
00:40:20.789594 IP 142.251.35.161.443 > 192.168.4.4.49326: tcp 1418
00:40:20.789644 IP 142.251.35.161.443 > 192.168.4.4.49326: tcp 1418
00:40:20.789693 IP 142.251.35.161.443 > 192.168.4.4.49326: tcp 1418
00:40:20.789730 IP 142.251.35.161.443 > 192.168.4.4.49326: tcp 1418
00:40:20.790340 IP 142.251.35.161.443 > 192.168.4.4.49326: tcp 1418
00:40:20.790392 IP 142.251.35.161.443 > 192.168.4.4.49326: tcp 1418
00:40:20.790430 IP 142.251.35.161.443 > 192.168.4.4.49326: tcp 227
00:40:20.791408 IP 192.168.4.4.49326 > 142.251.35.161.443: tcp 0
00:40:20.794201 IP 192.168.4.4.49326 > 142.251.35.161.443: tcp 0
00:40:20.794594 IP 192.168.4.4.49326 > 142.251.35.161.443: tcp 0
00:40:20.794821 IP 192.168.4.4.49326 > 142.251.35.161.443: tcp 0
00:40:20.795353 IP 192.168.4.4.49326 > 142.251.35.161.443: tcp 0
00:40:20.795766 IP 192.168.4.4.49326 > 142.251.35.161.443: tcp 0
00:40:20.796191 IP 192.168.4.4.49326 > 142.251.35.161.443: tcp 0
00:40:20.796946 IP 192.168.4.4.49325 > 142.251.32.98.443: tcp 1087
00:40:20.797075 IP 192.168.4.4.49326 > 142.251.35.161.443: tcp 0
00:40:20.797363 IP 192.168.4.4.49326 > 142.251.35.161.443: tcp 0
00:40:20.797800 IP 192.168.4.4.49326 > 142.251.35.161.443: tcp 0
00:40:20.798347 IP 192.168.4.4.49326 > 142.251.35.161.443: tcp 0
00:40:20.798434 IP 192.168.4.4.49326 > 142.251.35.161.443: tcp 0
00:40:20.798692 IP 192.168.4.4.49326 > 142.251.35.161.443: tcp 0
00:40:20.799063 IP 192.168.4.4.49326 > 142.251.35.161.443: tcp 0
00:40:20.799212 IP 192.168.4.4.49326 > 142.251.35.161.443: tcp 0
00:40:20.799435 IP 192.168.4.4.49326 > 142.251.35.161.443: tcp 0
00:40:20.799659 IP 192.168.4.4.49326 > 142.251.35.161.443: tcp 39
00:40:20.802268 IP 142.251.32.98.443 > 192.168.4.4.49325: tcp 0
00:40:20.809395 IP 142.251.35.161.443 > 192.168.4.4.49326: tcp 0
00:40:20.823568 IP 142.251.32.98.443 > 192.168.4.4.49325: tcp 67
00:40:20.823842 IP 142.251.32.98.443 > 192.168.4.4.49325: tcp 31
00:40:20.823941 IP 142.251.32.98.443 > 192.168.4.4.49325: tcp 39
00:40:20.824973 IP 192.168.4.4.49325 > 142.251.32.98.443: tcp 0
00:40:20.826523 IP 192.168.4.4.49325 > 142.251.32.98.443: tcp 0
00:40:20.826753 IP 192.168.4.4.49325 > 142.251.32.98.443: tcp 39
00:40:20.835552 IP 142.251.32.98.443 > 192.168.4.4.49325: tcp 0
00:40:21.343814 IP 109.200.209.32.50002 > 192.168.4.17.57488: UDP, length 52
00:40:21.456175 IP 192.168.4.17.50184 > 17.57.144.54.5223: tcp 104
00:40:21.464658 IP 17.57.144.54.5223 > 192.168.4.17.50184: tcp 34
00:40:21.467956 IP 192.168.4.17.50184 > 17.57.144.54.5223: tcp 0
00:40:22.054056 IP 192.168.4.4.49327 > 142.250.65.194.443: tcp 1418
00:40:22.054332 IP 192.168.4.4.49327 > 142.250.65.194.443: tcp 20
00:40:22.057892 IP 142.250.65.194.443 > 192.168.4.4.49327: tcp 0
00:40:22.057945 IP 142.250.65.194.443 > 192.168.4.4.49327: tcp 0
00:40:22.079871 IP 142.250.65.194.443 > 192.168.4.4.49327: tcp 70
00:40:22.079924 IP 142.250.65.194.443 > 192.168.4.4.49327: tcp 73
00:40:22.080217 IP 142.250.65.194.443 > 192.168.4.4.49327: tcp 31
00:40:22.080263 IP 142.250.65.194.443 > 192.168.4.4.49327: tcp 39
00:40:22.083092 IP 192.168.4.4.49327 > 142.250.65.194.443: tcp 0
00:40:22.083500 IP 192.168.4.4.49327 > 142.250.65.194.443: tcp 0
00:40:22.084168 IP 192.168.4.4.49327 > 142.250.65.194.443: tcp 39
00:40:22.093049 IP 142.250.65.194.443 > 192.168.4.4.49327: tcp 0
00:40:22.343555 IP 109.200.209.32.50002 > 192.168.4.17.57488: UDP, length 52
00:40:23.194065 IP 192.168.4.17.35660 > 192.168.4.1.53: UDP, length 52
00:40:23.275759 IP 192.168.4.1.53 > 192.168.4.17.35660: UDP, length 148
00:40:23.277531 IP 192.168.4.17.50268 > 136.243.40.109.443: tcp 0
00:40:23.343787 IP 109.200.209.32.50002 > 192.168.4.17.57488: UDP, length 52
00:40:23.381620 IP 136.243.40.109.443 > 192.168.4.17.50268: tcp 0
00:40:23.382971 IP 192.168.4.17.50268 > 136.243.40.109.443: tcp 0
00:40:23.383404 IP 192.168.4.17.50268 > 136.243.40.109.443: tcp 517
00:40:23.488329 IP 136.243.40.109.443 > 192.168.4.17.50268: tcp 0
00:40:23.488564 IP 136.243.40.109.443 > 192.168.4.17.50268: tcp 1448
00:40:23.488606 IP 136.243.40.109.443 > 192.168.4.17.50268: tcp 1448
00:40:23.488699 IP 136.243.40.109.443 > 192.168.4.17.50268: tcp 673
00:40:23.494358 IP 192.168.4.17.50268 > 136.243.40.109.443: tcp 0
00:40:23.494744 IP 192.168.4.17.50268 > 136.243.40.109.443: tcp 0
00:40:23.494970 IP 192.168.4.17.50268 > 136.243.40.109.443: tcp 0
00:40:23.501427 IP 192.168.4.17.50268 > 136.243.40.109.443: tcp 64
00:40:23.501909 IP 192.168.4.17.50268 > 136.243.40.109.443: tcp 770
00:40:23.604466 IP 136.243.40.109.443 > 192.168.4.17.50268: tcp 303
00:40:23.604532 IP 136.243.40.109.443 > 192.168.4.17.50268: tcp 303
00:40:23.606434 IP 192.168.4.17.50268 > 136.243.40.109.443: tcp 0
00:40:23.606672 IP 136.243.40.109.443 > 192.168.4.17.50268: tcp 1448
00:40:23.606729 IP 136.243.40.109.443 > 192.168.4.17.50268: tcp 1448
00:40:23.606779 IP 136.243.40.109.443 > 192.168.4.17.50268: tcp 1448
00:40:23.606829 IP 136.243.40.109.443 > 192.168.4.17.50268: tcp 1448
00:40:23.606880 IP 136.243.40.109.443 > 192.168.4.17.50268: tcp 1448
00:40:23.606931 IP 136.243.40.109.443 > 192.168.4.17.50268: tcp 1448
00:40:23.606985 IP 136.243.40.109.443 > 192.168.4.17.50268: tcp 1448
00:40:23.607056 IP 136.243.40.109.443 > 192.168.4.17.50268: tcp 1448
00:40:23.607210 IP 192.168.4.17.50268 > 136.243.40.109.443: tcp 0
00:40:23.610842 IP 192.168.4.17.50268 > 136.243.40.109.443: tcp 0
00:40:23.611459 IP 192.168.4.17.50268 > 136.243.40.109.443: tcp 0
00:40:23.612117 IP 192.168.4.17.50268 > 136.243.40.109.443: tcp 0
00:40:23.612526 IP 192.168.4.17.50268 > 136.243.40.109.443: tcp 0
00:40:23.612927 IP 192.168.4.17.50268 > 136.243.40.109.443: tcp 0
00:40:23.613331 IP 192.168.4.17.50268 > 136.243.40.109.443: tcp 0
00:40:23.613418 IP 192.168.4.17.50268 > 136.243.40.109.443: tcp 0
00:40:23.613676 IP 192.168.4.17.50268 > 136.243.40.109.443: tcp 0
00:40:23.709385 IP 136.243.40.109.443 > 192.168.4.17.50268: tcp 1448
00:40:23.709451 IP 136.243.40.109.443 > 192.168.4.17.50268: tcp 1448
00:40:23.711183 IP 192.168.4.17.50268 > 136.243.40.109.443: tcp 0
00:40:23.711560 IP 136.243.40.109.443 > 192.168.4.17.50268: tcp 1448
00:40:23.711608 IP 136.243.40.109.443 > 192.168.4.17.50268: tcp 1448
00:40:23.711767 IP 192.168.4.17.50268 > 136.243.40.109.443: tcp 0
00:40:23.713500 IP 192.168.4.17.50268 > 136.243.40.109.443: tcp 0
00:40:23.714810 IP 136.243.40.109.443 > 192.168.4.17.50268: tcp 1448
00:40:23.714872 IP 136.243.40.109.443 > 192.168.4.17.50268: tcp 1448
00:40:23.714923 IP 136.243.40.109.443 > 192.168.4.17.50268: tcp 1448
00:40:23.714961 IP 136.243.40.109.443 > 192.168.4.17.50268: tcp 1448
00:40:23.716585 IP 136.243.40.109.443 > 192.168.4.17.50268: tcp 1448
00:40:23.716646 IP 136.243.40.109.443 > 192.168.4.17.50268: tcp 1448
00:40:23.716695 IP 136.243.40.109.443 > 192.168.4.17.50268: tcp 1448
00:40:23.716744 IP 136.243.40.109.443 > 192.168.4.17.50268: tcp 1448
00:40:23.716814 IP 136.243.40.109.443 > 192.168.4.17.50268: tcp 1448
00:40:23.716866 IP 136.243.40.109.443 > 192.168.4.17.50268: tcp 1448
00:40:23.716922 IP 136.243.40.109.443 > 192.168.4.17.50268: tcp 1448
00:40:23.716962 IP 136.243.40.109.443 > 192.168.4.17.50268: tcp 1448
00:40:23.717095 IP 136.243.40.109.443 > 192.168.4.17.50268: tcp 1448
00:40:23.717134 IP 136.243.40.109.443 > 192.168.4.17.50268: tcp 1448
00:40:23.717454 IP 192.168.4.17.50268 > 136.243.40.109.443: tcp 0
00:40:23.718075 IP 136.243.40.109.443 > 192.168.4.17.50268: tcp 1448
00:40:23.718123 IP 136.243.40.109.443 > 192.168.4.17.50268: tcp 1448
00:40:23.723042 IP 192.168.4.17.50268 > 136.243.40.109.443: tcp 0
00:40:23.723456 IP 192.168.4.17.50268 > 136.243.40.109.443: tcp 0
00:40:23.724814 IP 192.168.4.17.50268 > 136.243.40.109.443: tcp 0
00:40:23.725302 IP 192.168.4.17.50268 > 136.243.40.109.443: tcp 0
00:40:23.725702 IP 192.168.4.17.50268 > 136.243.40.109.443: tcp 0
00:40:23.726434 IP 192.168.4.17.50268 > 136.243.40.109.443: tcp 0
00:40:23.726521 IP 192.168.4.17.50268 > 136.243.40.109.443: tcp 0
00:40:23.726778 IP 192.168.4.17.50268 > 136.243.40.109.443: tcp 0
00:40:23.726997 IP 192.168.4.17.50268 > 136.243.40.109.443: tcp 0
00:40:23.727272 IP 192.168.4.17.50268 > 136.243.40.109.443: tcp 0
00:40:23.814182 IP 136.243.40.109.443 > 192.168.4.17.50268: tcp 1165
00:40:23.816002 IP 192.168.4.17.50268 > 136.243.40.109.443: tcp 0
00:40:23.959789 IP 192.168.4.17.57488 > 109.200.209.32.50002: UDP, length 60
00:40:24.298902 IP 192.168.4.17.37182 > 192.168.4.1.53: UDP, length 46
00:40:24.343712 IP 109.200.209.32.50002 > 192.168.4.17.57488: UDP, length 52
00:40:24.418401 IP 192.168.4.1.53 > 192.168.4.17.37182: UDP, length 190
00:40:24.420571 IP 192.168.4.17.50269 > 95.216.14.104.443: tcp 0
00:40:24.516330 IP 95.216.14.104.443 > 192.168.4.17.50269: tcp 0
00:40:24.517698 IP 192.168.4.17.50269 > 95.216.14.104.443: tcp 0
00:40:24.518345 IP 192.168.4.17.50269 > 95.216.14.104.443: tcp 517
00:40:24.598312 IP 192.168.4.17.50182 > 162.159.137.234.443: tcp 61
00:40:24.603253 IP 162.159.137.234.443 > 192.168.4.17.50182: tcp 57
00:40:24.604476 IP 192.168.4.17.50182 > 162.159.137.234.443: tcp 0
00:40:24.614505 IP 95.216.14.104.443 > 192.168.4.17.50269: tcp 0
00:40:24.615483 IP 95.216.14.104.443 > 192.168.4.17.50269: tcp 1448
00:40:24.615536 IP 95.216.14.104.443 > 192.168.4.17.50269: tcp 1448
00:40:24.615659 IP 95.216.14.104.443 > 192.168.4.17.50269: tcp 523
00:40:24.617544 IP 192.168.4.17.50269 > 95.216.14.104.443: tcp 0
00:40:24.617935 IP 192.168.4.17.50269 > 95.216.14.104.443: tcp 0
00:40:24.618213 IP 192.168.4.17.50269 > 95.216.14.104.443: tcp 0
00:40:24.625360 IP 192.168.4.17.50269 > 95.216.14.104.443: tcp 126
00:40:24.721243 IP 95.216.14.104.443 > 192.168.4.17.50269: tcp 274
00:40:24.722621 IP 192.168.4.17.50269 > 95.216.14.104.443: tcp 0
00:40:24.723236 IP 192.168.4.17.50269 > 95.216.14.104.443: tcp 798
00:40:24.842294 IP 95.216.14.104.443 > 192.168.4.17.50269: tcp 371
00:40:24.843071 IP 95.216.14.104.443 > 192.168.4.17.50269: tcp 31
00:40:24.846353 IP 192.168.4.17.50269 > 95.216.14.104.443: tcp 0
00:40:24.846763 IP 192.168.4.17.50269 > 95.216.14.104.443: tcp 0
00:40:24.846989 IP 192.168.4.17.50269 > 95.216.14.104.443: tcp 0
00:40:24.941611 IP 95.216.14.104.443 > 192.168.4.17.50269: tcp 0
00:40:24.943136 IP 192.168.4.17.50269 > 95.216.14.104.443: tcp 0
00:40:25.343659 IP 109.200.209.32.50002 > 192.168.4.17.57488: UDP, length 52
00:40:25.414409 IP 192.168.4.17.57488 > 109.200.209.32.50002: UDP, length 8
00:40:25.419987 IP 109.200.209.32.50002 > 192.168.4.17.57488: UDP, length 8
00:40:25.688968 IP 192.168.4.4.49766 > 192.168.4.17.20: tcp 0
00:40:25.797731 IP 192.168.4.17.20 > 192.168.4.4.49766: tcp 0
00:40:25.892167 IP 192.168.4.4.49767 > 192.168.4.17.21: tcp 0
00:40:25.892939 IP 192.168.4.17.21 > 192.168.4.4.49767: tcp 0
00:40:25.895983 IP 192.168.4.4.49768 > 192.168.4.17.22: tcp 0
00:40:25.896841 IP 192.168.4.17.22 > 192.168.4.4.49768: tcp 0
00:40:25.899260 IP 192.168.4.4.49769 > 192.168.4.17.53: tcp 0
00:40:25.900291 IP 192.168.4.17.53 > 192.168.4.4.49769: tcp 0
00:40:25.902347 IP 192.168.4.4.49770 > 192.168.4.17.80: tcp 0
00:40:25.903496 IP 192.168.4.17.80 > 192.168.4.4.49770: tcp 0
00:40:25.923794 IP 192.168.4.17.50183 > 162.159.133.234.443: tcp 51
00:40:25.947307 IP 162.159.133.234.443 > 192.168.4.17.50183: tcp 33
00:40:25.948882 IP 192.168.4.17.50183 > 162.159.133.234.443: tcp 0
00:40:26.343630 IP 109.200.209.32.50002 > 192.168.4.17.57488: UDP, length 52
00:40:26.745950 IP 162.159.133.234.443 > 192.168.4.17.50183: tcp 101
00:40:26.822689 IP 192.168.4.17.50183 > 162.159.133.234.443: tcp 0
00:40:27.343713 IP 109.200.209.32.50002 > 192.168.4.17.57488: UDP, length 52
00:40:28.343429 IP 109.200.209.32.50002 > 192.168.4.17.57488: UDP, length 52
00:40:28.606599 IP 136.243.40.109.443 > 192.168.4.17.50268: tcp 24
00:40:28.607113 IP 136.243.40.109.443 > 192.168.4.17.50268: tcp 0
00:40:28.662786 IP 192.168.4.17.50268 > 136.243.40.109.443: tcp 0
00:40:28.663068 IP 192.168.4.17.50268 > 136.243.40.109.443: tcp 0
00:40:28.935719 IP 192.168.4.17.50198 > 184.73.65.60.443: tcp 0
00:40:28.946069 IP 184.73.65.60.443 > 192.168.4.17.50198: tcp 0
00:40:29.343551 IP 109.200.209.32.50002 > 192.168.4.17.57488: UDP, length 52
00:40:29.728654 IP 192.168.4.17.51232 > 162.159.138.232.443: UDP, length 816
00:40:29.735472 IP 162.159.138.232.443 > 192.168.4.17.51232: UDP, length 24
00:40:29.852481 IP 162.159.138.232.443 > 192.168.4.17.51232: UDP, length 792
00:40:29.883163 IP 192.168.4.17.51232 > 162.159.138.232.443: UDP, length 45
00:40:29.886614 IP 162.159.138.232.443 > 192.168.4.17.51232: UDP, length 800
00:40:29.914540 IP 192.168.4.17.51232 > 162.159.138.232.443: UDP, length 45
00:40:30.318219 IP 23.78.2.47.443 > 192.168.4.4.49336: tcp 24
00:40:30.319031 IP 23.78.2.47.443 > 192.168.4.4.49336: tcp 0
00:40:30.343476 IP 109.200.209.32.50002 > 192.168.4.17.57488: UDP, length 52
00:40:30.346547 IP 23.78.2.47.443 > 192.168.4.4.49336: tcp 0
00:40:30.380276 IP 192.168.4.17.57488 > 109.200.209.32.50002: UDP, length 60
00:40:30.405177 IP 192.168.4.4.49336 > 23.78.2.47.443: tcp 0
00:40:30.405777 IP 192.168.4.4.49336 > 23.78.2.47.443: tcp 0
00:40:30.406214 IP 192.168.4.4.49336 > 23.78.2.47.443: tcp 0
00:40:30.406440 IP 192.168.4.4.49336 > 23.78.2.47.443: tcp 24
00:40:30.406672 IP 192.168.4.4.49336 > 23.78.2.47.443: tcp 0
00:40:30.411432 IP 192.168.4.17.57488 > 109.200.209.32.50002: UDP, length 8
00:40:30.412038 IP 23.78.2.47.443 > 192.168.4.4.49336: tcp 0
00:40:30.412091 IP 23.78.2.47.443 > 192.168.4.4.49336: tcp 0
00:40:30.416739 IP 109.200.209.32.50002 > 192.168.4.17.57488: UDP, length 8
00:40:30.787368 IP 192.168.4.4.4500 > 208.54.35.163.4500: UDP, length 1
00:40:30.975042 ARP, Request who-has 192.168.4.17 tell 192.168.4.1, length 28
00:40:31.020824 ARP, Reply 192.168.4.17 is-at f8:ff:c2:68:f7:91, length 28
00:40:31.343780 IP 109.200.209.32.50002 > 192.168.4.17.57488: UDP, length 52
00:40:32.275439 IP 74.6.106.26.993 > 192.168.4.4.65429: tcp 74
00:40:32.303776 IP 74.6.106.26.993 > 192.168.4.4.65429: tcp 40
00:40:32.303948 IP 74.6.106.26.993 > 192.168.4.4.65429: tcp 0
00:40:32.337838 IP 74.6.106.26.993 > 192.168.4.4.65429: tcp 0
00:40:32.343644 IP 109.200.209.32.50002 > 192.168.4.17.57488: UDP, length 52
00:40:32.350804 IP 192.168.4.4.65429 > 74.6.106.26.993: tcp 0
00:40:32.351307 IP 192.168.4.4.65429 > 74.6.106.26.993: tcp 0
00:40:32.351688 IP 192.168.4.4.65429 > 74.6.106.26.993: tcp 0
00:40:32.351916 IP 192.168.4.4.65429 > 74.6.106.26.993: tcp 24
00:40:32.353267 IP 192.168.4.4.65429 > 74.6.106.26.993: tcp 0
00:40:32.365867 IP 74.6.106.26.993 > 192.168.4.4.65429: tcp 0
00:40:32.367337 IP 74.6.106.26.993 > 192.168.4.4.65429: tcp 0
00:40:32.390585 IP 192.168.4.17.50173 > 3.221.200.233.443: tcp 38
00:40:32.402253 IP 3.221.200.233.443 > 192.168.4.17.50173: tcp 32
00:40:32.403731 IP 192.168.4.17.50173 > 3.221.200.233.443: tcp 0
00:40:33.246878 IP 192.168.4.17.50192 > 35.186.224.47.443: tcp 43
00:40:33.255684 IP 35.186.224.47.443 > 192.168.4.17.50192: tcp 0
00:40:33.278528 IP 35.186.224.47.443 > 192.168.4.17.50192: tcp 40
00:40:33.291589 IP 192.168.4.17.57488 > 109.200.209.32.50002: UDP, length 60
00:40:33.292017 IP 192.168.4.17.50192 > 35.186.224.47.443: tcp 0
00:40:33.343493 IP 109.200.209.32.50002 > 192.168.4.17.57488: UDP, length 52
00:40:34.343487 IP 109.200.209.32.50002 > 192.168.4.17.57488: UDP, length 52
00:40:34.345971 IP 74.6.106.26.993 > 192.168.4.4.65416: tcp 74
00:40:34.384419 IP 74.6.106.26.993 > 192.168.4.4.65416: tcp 40
00:40:34.384592 IP 74.6.106.26.993 > 192.168.4.4.65416: tcp 0
00:40:34.420027 IP 74.6.106.26.993 > 192.168.4.4.65416: tcp 0
00:40:34.502447 IP 192.168.4.4.65416 > 74.6.106.26.993: tcp 0
00:40:34.502848 IP 192.168.4.4.65416 > 74.6.106.26.993: tcp 0
00:40:34.502936 IP 192.168.4.4.65416 > 74.6.106.26.993: tcp 0
00:40:34.503082 IP 192.168.4.4.65416 > 74.6.106.26.993: tcp 24
00:40:34.503223 IP 192.168.4.4.65416 > 74.6.106.26.993: tcp 0
00:40:34.517779 IP 74.6.106.26.993 > 192.168.4.4.65416: tcp 0
00:40:34.517831 IP 74.6.106.26.993 > 192.168.4.4.65416: tcp 0
00:40:35.214681 IP 192.168.4.17.62939 > 192.168.4.1.53: UDP, length 37
00:40:35.215529 IP 192.168.4.17.55036 > 192.168.4.1.53: UDP, length 37
00:40:35.218328 IP 192.168.4.1.53 > 192.168.4.17.62939: UDP, length 131
00:40:35.220334 IP 192.168.4.17.56257 > 192.168.4.1.53: UDP, length 46
00:40:35.221037 IP 192.168.4.17.53634 > 192.168.4.1.53: UDP, length 46
00:40:35.233164 IP 192.168.4.1.53 > 192.168.4.17.55036: UDP, length 92
00:40:35.233394 IP 192.168.4.1.53 > 192.168.4.17.53634: UDP, length 62
00:40:35.236347 IP 192.168.4.1.53 > 192.168.4.17.56257: UDP, length 107
00:40:35.238912 IP 192.168.4.17.50270 > 44.235.78.64.443: tcp 0
00:40:35.313422 IP 44.235.78.64.443 > 192.168.4.17.50270: tcp 0
00:40:35.316857 IP 192.168.4.17.50270 > 44.235.78.64.443: tcp 0
00:40:35.317507 IP 192.168.4.17.50270 > 44.235.78.64.443: tcp 517
00:40:35.343613 IP 109.200.209.32.50002 > 192.168.4.17.57488: UDP, length 52
00:40:35.391082 IP 44.235.78.64.443 > 192.168.4.17.50270: tcp 0
00:40:35.393529 IP 44.235.78.64.443 > 192.168.4.17.50270: tcp 1448
00:40:35.393583 IP 44.235.78.64.443 > 192.168.4.17.50270: tcp 1448
00:40:35.393705 IP 44.235.78.64.443 > 192.168.4.17.50270: tcp 974
00:40:35.395508 IP 192.168.4.17.50270 > 44.235.78.64.443: tcp 0
00:40:35.395901 IP 192.168.4.17.50270 > 44.235.78.64.443: tcp 0
00:40:35.396173 IP 192.168.4.17.50270 > 44.235.78.64.443: tcp 0
00:40:35.404032 IP 192.168.4.17.50270 > 44.235.78.64.443: tcp 64
00:40:35.406710 IP 192.168.4.17.50270 > 44.235.78.64.443: tcp 46
00:40:35.407148 IP 192.168.4.17.50270 > 44.235.78.64.443: tcp 43
00:40:35.407370 IP 192.168.4.17.50270 > 44.235.78.64.443: tcp 35
00:40:35.408016 IP 192.168.4.17.50270 > 44.235.78.64.443: tcp 286
00:40:35.408105 IP 192.168.4.17.50270 > 44.235.78.64.443: tcp 881
00:40:35.408250 IP 192.168.4.17.50270 > 44.235.78.64.443: tcp 31
00:40:35.416452 IP 192.168.4.17.57488 > 109.200.209.32.50002: UDP, length 8
00:40:35.422265 IP 109.200.209.32.50002 > 192.168.4.17.57488: UDP, length 8
00:40:35.476223 IP 44.235.78.64.443 > 192.168.4.17.50270: tcp 0
00:40:35.476319 IP 44.235.78.64.443 > 192.168.4.17.50270: tcp 55
00:40:35.477827 IP 192.168.4.17.50270 > 44.235.78.64.443: tcp 0
00:40:35.478167 IP 192.168.4.17.50270 > 44.235.78.64.443: tcp 31
00:40:35.479757 IP 44.235.78.64.443 > 192.168.4.17.50270: tcp 0
00:40:35.479817 IP 44.235.78.64.443 > 192.168.4.17.50270: tcp 0
00:40:35.479877 IP 44.235.78.64.443 > 192.168.4.17.50270: tcp 0
00:40:35.480049 IP 44.235.78.64.443 > 192.168.4.17.50270: tcp 0
00:40:35.480097 IP 44.235.78.64.443 > 192.168.4.17.50270: tcp 0
00:40:35.480168 IP 44.235.78.64.443 > 192.168.4.17.50270: tcp 0
00:40:35.480207 IP 44.235.78.64.443 > 192.168.4.17.50270: tcp 35
00:40:35.480243 IP 44.235.78.64.443 > 192.168.4.17.50270: tcp 31
00:40:35.480279 IP 44.235.78.64.443 > 192.168.4.17.50270: tcp 35
00:40:35.482426 IP 192.168.4.17.50270 > 44.235.78.64.443: tcp 0
00:40:35.482831 IP 192.168.4.17.50270 > 44.235.78.64.443: tcp 0
00:40:35.497204 IP 44.235.78.64.443 > 192.168.4.17.50270: tcp 59
00:40:35.498666 IP 192.168.4.17.50270 > 44.235.78.64.443: tcp 0
00:40:35.509389 IP 192.168.4.17.50270 > 44.235.78.64.443: tcp 39
00:40:35.510015 IP 192.168.4.17.50270 > 44.235.78.64.443: tcp 24
00:40:35.511540 IP 192.168.4.17.50270 > 44.235.78.64.443: tcp 0
00:40:35.549598 IP 44.235.78.64.443 > 192.168.4.17.50270: tcp 0
00:40:35.571211 IP 192.168.4.17.51232 > 162.159.138.232.443: UDP, length 905
00:40:35.576299 IP 162.159.138.232.443 > 192.168.4.17.51232: UDP, length 24
00:40:35.581940 IP 44.235.78.64.443 > 192.168.4.17.50270: tcp 0
00:40:35.582099 IP 44.235.78.64.443 > 192.168.4.17.50270: tcp 24
00:40:35.582465 IP 44.235.78.64.443 > 192.168.4.17.50270: tcp 0
00:40:35.583405 IP 192.168.4.17.50270 > 44.235.78.64.443: tcp 0
00:40:35.583795 IP 44.235.78.64.443 > 192.168.4.17.50270: tcp 0
00:40:35.583929 IP 192.168.4.17.50270 > 44.235.78.64.443: tcp 0
00:40:35.585520 IP 192.168.4.17.50270 > 44.235.78.64.443: tcp 0
00:40:36.343582 IP 109.200.209.32.50002 > 192.168.4.17.57488: UDP, length 52
00:40:36.373036 IP 162.159.133.234.443 > 192.168.4.17.50183: tcp 308
00:40:36.397581 IP 162.159.138.232.443 > 192.168.4.17.51232: UDP, length 1150
00:40:36.434372 IP 162.159.138.232.443 > 192.168.4.17.51232: UDP, length 1158
00:40:36.453318 IP 192.168.4.17.50183 > 162.159.133.234.443: tcp 0
00:40:36.453729 IP 192.168.4.17.51232 > 162.159.138.232.443: UDP, length 45
00:40:37.343908 IP 109.200.209.32.50002 > 192.168.4.17.57488: UDP, length 52
00:40:38.262032 IP 192.168.4.17.57488 > 109.200.209.32.50002: UDP, length 60
00:40:38.343809 IP 109.200.209.32.50002 > 192.168.4.17.57488: UDP, length 52
00:40:38.348507 IP 192.168.4.17.50182 > 162.159.137.234.443: tcp 61
00:40:38.354762 IP 162.159.137.234.443 > 192.168.4.17.50182: tcp 57
00:40:38.356057 IP 192.168.4.17.50182 > 162.159.137.234.443: tcp 0
00:40:38.921519 IP 192.168.4.17.50169 > 140.82.113.25.443: tcp 0
00:40:38.932766 IP 140.82.113.25.443 > 192.168.4.17.50169: tcp 0
00:40:39.343634 IP 109.200.209.32.50002 > 192.168.4.17.57488: UDP, length 52
00:40:40.343501 IP 109.200.209.32.50002 > 192.168.4.17.57488: UDP, length 52
00:40:40.428263 IP 192.168.4.17.57488 > 109.200.209.32.50002: UDP, length 8
00:40:40.434030 IP 109.200.209.32.50002 > 192.168.4.17.57488: UDP, length 8
00:40:40.581586 IP 192.168.4.17.64955 > 142.250.65.196.443: UDP, length 1250
00:40:40.582066 IP 192.168.4.17.64955 > 142.250.65.196.443: UDP, length 79
00:40:40.595024 IP 142.250.65.196.443 > 192.168.4.17.64955: UDP, length 1250
00:40:40.595074 IP 142.250.65.196.443 > 192.168.4.17.64955: UDP, length 622
00:40:40.597251 IP 192.168.4.17.64955 > 142.250.65.196.443: UDP, length 78
00:40:40.597635 IP 192.168.4.17.64955 > 142.250.65.196.443: UDP, length 33
00:40:40.601285 IP 142.250.65.196.443 > 192.168.4.17.64955: UDP, length 99
00:40:40.601524 IP 192.168.4.17.64955 > 142.250.65.196.443: UDP, length 1246
00:40:40.601612 IP 192.168.4.17.64955 > 142.250.65.196.443: UDP, length 691
00:40:40.607020 IP 142.250.65.196.443 > 192.168.4.17.64955: UDP, length 25
00:40:40.607069 IP 142.250.65.196.443 > 192.168.4.17.64955: UDP, length 25
00:40:40.608467 IP 192.168.4.17.64955 > 142.250.65.196.443: UDP, length 34
00:40:40.652448 IP 142.250.65.196.443 > 192.168.4.17.64955: UDP, length 257
00:40:40.653869 IP 192.168.4.17.64955 > 142.250.65.196.443: UDP, length 35
00:40:40.655043 IP 142.250.65.196.443 > 192.168.4.17.64955: UDP, length 25
00:40:40.682159 IP 192.168.4.17.64955 > 142.250.65.196.443: UDP, length 33
00:40:40.683228 IP 142.250.65.196.443 > 192.168.4.17.64955: UDP, length 25
00:40:40.909758 IP 192.168.4.17.62318 > 142.250.65.196.443: UDP, length 1250
00:40:40.910058 IP 192.168.4.17.62318 > 142.250.65.196.443: UDP, length 78
00:40:40.922633 IP 142.250.65.196.443 > 192.168.4.17.62318: UDP, length 1250
00:40:40.922682 IP 142.250.65.196.443 > 192.168.4.17.62318: UDP, length 622
00:40:40.925263 IP 192.168.4.17.62318 > 142.250.65.196.443: UDP, length 78
00:40:40.925484 IP 192.168.4.17.62318 > 142.250.65.196.443: UDP, length 33
00:40:40.930319 IP 142.250.65.196.443 > 192.168.4.17.62318: UDP, length 99
00:40:40.957277 IP 192.168.4.17.62318 > 142.250.65.196.443: UDP, length 33
00:40:41.260581 IP 192.168.4.4.49338 > 23.39.34.68.443: tcp 24
00:40:41.260853 IP 192.168.4.4.49338 > 23.39.34.68.443: tcp 0
00:40:41.263933 IP 23.39.34.68.443 > 192.168.4.4.49338: tcp 0
00:40:41.276201 IP 23.39.34.68.443 > 192.168.4.4.49338: tcp 24
00:40:41.276912 IP 23.39.34.68.443 > 192.168.4.4.49338: tcp 0
00:40:41.277929 IP 192.168.4.4.49338 > 23.39.34.68.443: tcp 0
00:40:41.343585 IP 109.200.209.32.50002 > 192.168.4.17.57488: UDP, length 52
00:40:42.343565 IP 109.200.209.32.50002 > 192.168.4.17.57488: UDP, length 52
00:40:43.343630 IP 109.200.209.32.50002 > 192.168.4.17.57488: UDP, length 52
00:40:43.382366 IP 192.168.4.17.50197 > 52.201.47.39.443: tcp 0
00:40:43.392253 IP 52.201.47.39.443 > 192.168.4.17.50197: tcp 0
00:40:43.676165 IP 192.168.4.17.64955 > 142.250.65.196.443: UDP, length 218
00:40:43.681078 IP 142.250.65.196.443 > 192.168.4.17.64955: UDP, length 27
00:40:43.707929 IP 192.168.4.17.64955 > 142.250.65.196.443: UDP, length 33
00:40:43.718097 IP 142.250.65.196.443 > 192.168.4.17.64955: UDP, length 63
00:40:43.718251 IP 142.250.65.196.443 > 192.168.4.17.64955: UDP, length 25
00:40:43.719667 IP 192.168.4.17.64955 > 142.250.65.196.443: UDP, length 35
00:40:43.745492 IP 192.168.4.17.64955 > 142.250.65.196.443: UDP, length 33
00:40:43.750751 IP 142.250.65.196.443 > 192.168.4.17.64955: UDP, length 25
00:40:43.822483 IP 192.168.4.17.64955 > 142.250.65.196.443: UDP, length 92
00:40:43.826650 IP 142.250.65.196.443 > 192.168.4.17.64955: UDP, length 27
00:40:43.853388 IP 192.168.4.17.64955 > 142.250.65.196.443: UDP, length 33
00:40:43.865072 IP 192.168.4.17.64955 > 142.250.65.196.443: UDP, length 108
00:40:43.869138 IP 142.250.65.196.443 > 192.168.4.17.64955: UDP, length 27
00:40:43.876218 IP 192.168.4.17.64955 > 142.250.65.196.443: UDP, length 101
00:40:43.878280 IP 142.250.65.196.443 > 192.168.4.17.64955: UDP, length 536
00:40:43.878373 IP 142.250.65.196.443 > 192.168.4.17.64955: UDP, length 173
00:40:43.879950 IP 192.168.4.17.64955 > 142.250.65.196.443: UDP, length 35
00:40:43.881591 IP 142.250.65.196.443 > 192.168.4.17.64955: UDP, length 27
00:40:43.883028 IP 192.168.4.17.64955 > 142.250.65.196.443: UDP, length 33
00:40:43.886848 IP 192.168.4.17.64955 > 142.250.65.196.443: UDP, length 160
00:40:43.892200 IP 142.250.65.196.443 > 192.168.4.17.64955: UDP, length 27
00:40:43.905083 IP 192.168.4.17.64955 > 142.250.65.196.443: UDP, length 132
00:40:43.910052 IP 142.250.65.196.443 > 192.168.4.17.64955: UDP, length 27
00:40:43.936706 IP 142.250.65.196.443 > 192.168.4.17.64955: UDP, length 1246
00:40:43.936764 IP 142.250.65.196.443 > 192.168.4.17.64955: UDP, length 1250
00:40:43.936810 IP 142.250.65.196.443 > 192.168.4.17.64955: UDP, length 1250
00:40:43.936857 IP 142.250.65.196.443 > 192.168.4.17.64955: UDP, length 1250
00:40:43.936891 IP 142.250.65.196.443 > 192.168.4.17.64955: UDP, length 1063
00:40:43.937138 IP 142.250.65.196.443 > 192.168.4.17.64955: UDP, length 157
00:40:43.937187 IP 142.250.65.196.443 > 192.168.4.17.64955: UDP, length 1245
00:40:43.937232 IP 142.250.65.196.443 > 192.168.4.17.64955: UDP, length 1250
00:40:43.937277 IP 142.250.65.196.443 > 192.168.4.17.64955: UDP, length 1250
00:40:43.937322 IP 142.250.65.196.443 > 192.168.4.17.64955: UDP, length 1250
00:40:43.937367 IP 142.250.65.196.443 > 192.168.4.17.64955: UDP, length 1250
00:40:43.937413 IP 142.250.65.196.443 > 192.168.4.17.64955: UDP, length 1250
00:40:43.937461 IP 142.250.65.196.443 > 192.168.4.17.64955: UDP, length 1250
00:40:43.937510 IP 142.250.65.196.443 > 192.168.4.17.64955: UDP, length 1250
00:40:43.937545 IP 142.250.65.196.443 > 192.168.4.17.64955: UDP, length 1250
00:40:43.937851 IP 192.168.4.17.64955 > 142.250.65.196.443: UDP, length 33
00:40:43.938251 IP 142.250.65.196.443 > 192.168.4.17.64955: UDP, length 1250
00:40:43.938307 IP 142.250.65.196.443 > 192.168.4.17.64955: UDP, length 1250
00:40:43.938352 IP 142.250.65.196.443 > 192.168.4.17.64955: UDP, length 1250
00:40:43.938397 IP 142.250.65.196.443 > 192.168.4.17.64955: UDP, length 1250
00:40:43.938443 IP 142.250.65.196.443 > 192.168.4.17.64955: UDP, length 1250
00:40:43.938489 IP 142.250.65.196.443 > 192.168.4.17.64955: UDP, length 1250
00:40:43.938524 IP 142.250.65.196.443 > 192.168.4.17.64955: UDP, length 1250
00:40:43.940482 IP 142.250.65.196.443 > 192.168.4.17.64955: UDP, length 1250
00:40:43.940529 IP 142.250.65.196.443 > 192.168.4.17.64955: UDP, length 1250
00:40:43.940573 IP 142.250.65.196.443 > 192.168.4.17.64955: UDP, length 1250
00:40:43.940618 IP 142.250.65.196.443 > 192.168.4.17.64955: UDP, length 1250
00:40:43.940664 IP 142.250.65.196.443 > 192.168.4.17.64955: UDP, length 1250
00:40:43.940710 IP 142.250.65.196.443 > 192.168.4.17.64955: UDP, length 1250
00:40:43.940757 IP 142.250.65.196.443 > 192.168.4.17.64955: UDP, length 1250
00:40:43.940805 IP 142.250.65.196.443 > 192.168.4.17.64955: UDP, length 1250
00:40:43.940840 IP 142.250.65.196.443 > 192.168.4.17.64955: UDP, length 1250
00:40:43.940911 IP 142.250.65.196.443 > 192.168.4.17.64955: UDP, length 1250
00:40:43.940954 IP 142.250.65.196.443 > 192.168.4.17.64955: UDP, length 913
00:40:43.941020 IP 142.250.65.196.443 > 192.168.4.17.64955: UDP, length 1243
00:40:43.941321 IP 142.250.65.196.443 > 192.168.4.17.64955: UDP, length 1184
00:40:43.942781 IP 192.168.4.17.64955 > 142.250.65.196.443: UDP, length 35
00:40:43.943047 IP 192.168.4.17.64955 > 142.250.65.196.443: UDP, length 33
00:40:43.944715 IP 192.168.4.17.64955 > 142.250.65.196.443: UDP, length 33
00:40:43.945192 IP 192.168.4.17.64955 > 142.250.65.196.443: UDP, length 33
00:40:43.945415 IP 192.168.4.17.64955 > 142.250.65.196.443: UDP, length 33
00:40:43.946735 IP 142.250.65.196.443 > 192.168.4.17.64955: UDP, length 209
00:40:43.946830 IP 142.250.65.196.443 > 192.168.4.17.64955: UDP, length 25
00:40:43.949926 IP 192.168.4.17.64955 > 142.250.65.196.443: UDP, length 33
00:40:43.950348 IP 192.168.4.17.64955 > 142.250.65.196.443: UDP, length 33
00:40:43.951288 IP 142.250.65.196.443 > 192.168.4.17.64955: UDP, length 264
00:40:43.951335 IP 142.250.65.196.443 > 192.168.4.17.64955: UDP, length 114
00:40:43.951608 IP 192.168.4.17.64955 > 142.250.65.196.443: UDP, length 33
00:40:43.952019 IP 192.168.4.17.64955 > 142.250.65.196.443: UDP, length 33
00:40:43.952474 IP 192.168.4.17.64955 > 142.250.65.196.443: UDP, length 33
00:40:43.952844 IP 192.168.4.17.64955 > 142.250.65.196.443: UDP, length 33
00:40:43.953093 IP 192.168.4.17.64955 > 142.250.65.196.443: UDP, length 33
00:40:43.953334 IP 192.168.4.17.64955 > 142.250.65.196.443: UDP, length 33
00:40:43.953553 IP 192.168.4.17.64955 > 142.250.65.196.443: UDP, length 33
00:40:43.963365 IP 192.168.4.17.64955 > 142.250.65.196.443: UDP, length 33
00:40:43.963746 IP 192.168.4.17.64955 > 142.250.65.196.443: UDP, length 33
00:40:43.964192 IP 192.168.4.17.64955 > 142.250.65.196.443: UDP, length 33
00:40:43.964535 IP 192.168.4.17.64955 > 142.250.65.196.443: UDP, length 33
00:40:43.964617 IP 192.168.4.17.64955 > 142.250.65.196.443: UDP, length 35
00:40:43.965133 IP 192.168.4.17.64955 > 142.250.65.196.443: UDP, length 35
00:40:43.970199 IP 142.250.65.196.443 > 192.168.4.17.64955: UDP, length 25
00:40:43.980879 IP 192.168.4.17.64955 > 142.250.65.196.443: UDP, length 33
00:40:44.019654 IP 142.250.65.196.443 > 192.168.4.17.64955: UDP, length 298
00:40:44.019702 IP 142.250.65.196.443 > 192.168.4.17.64955: UDP, length 62
00:40:44.022039 IP 192.168.4.17.64955 > 142.250.65.196.443: UDP, length 35
00:40:44.047391 IP 192.168.4.17.64955 > 142.250.65.196.443: UDP, length 33
00:40:44.052184 IP 142.250.65.196.443 > 192.168.4.17.64955: UDP, length 26
00:40:44.130386 IP 192.168.4.17.64955 > 142.250.65.196.443: UDP, length 271
00:40:44.135812 IP 142.250.65.196.443 > 192.168.4.17.64955: UDP, length 28
00:40:44.162998 IP 192.168.4.17.64955 > 142.250.65.196.443: UDP, length 33
00:40:44.202870 IP 142.250.65.196.443 > 192.168.4.17.64955: UDP, length 1246
00:40:44.202934 IP 142.250.65.196.443 > 192.168.4.17.64955: UDP, length 285
00:40:44.204916 IP 192.168.4.17.64955 > 142.250.65.196.443: UDP, length 36
00:40:44.230407 IP 192.168.4.17.64955 > 142.250.65.196.443: UDP, length 33
00:40:44.235722 IP 142.250.65.196.443 > 192.168.4.17.64955: UDP, length 26
00:40:44.291744 IP 192.168.4.17.64955 > 142.250.65.196.443: UDP, length 33
00:40:44.291998 IP 192.168.4.17.64955 > 142.250.65.196.443: UDP, length 35
00:40:44.295402 IP 192.168.4.17.64955 > 142.250.65.196.443: UDP, length 195
00:40:44.295642 IP 142.250.65.196.443 > 192.168.4.17.64955: UDP, length 30
00:40:44.299422 IP 142.250.65.196.443 > 192.168.4.17.64955: UDP, length 28
00:40:44.303775 IP 192.168.4.17.64955 > 142.250.65.196.443: UDP, length 33
00:40:44.343864 IP 109.200.209.32.50002 > 192.168.4.17.57488: UDP, length 52
00:40:44.391771 IP 142.250.65.196.443 > 192.168.4.17.64955: UDP, length 1246
00:40:44.391820 IP 142.250.65.196.443 > 192.168.4.17.64955: UDP, length 314
00:40:44.393682 IP 192.168.4.17.64955 > 142.250.65.196.443: UDP, length 36
00:40:44.419314 IP 192.168.4.17.64955 > 142.250.65.196.443: UDP, length 33
00:40:44.423527 IP 142.250.65.196.443 > 192.168.4.17.64955: UDP, length 26
00:40:44.443907 IP 192.168.4.17.50218 > 54.185.50.32.443: tcp 0
00:40:44.473528 IP 192.168.4.17.64955 > 142.250.65.196.443: UDP, length 33
00:40:44.473914 IP 192.168.4.17.64955 > 142.250.65.196.443: UDP, length 35
00:40:44.477375 IP 192.168.4.17.64955 > 142.250.65.196.443: UDP, length 198
00:40:44.478632 IP 142.250.65.196.443 > 192.168.4.17.64955: UDP, length 30
00:40:44.482621 IP 142.250.65.196.443 > 192.168.4.17.64955: UDP, length 28
00:40:44.483952 IP 192.168.4.17.64955 > 142.250.65.196.443: UDP, length 33
00:40:44.515348 IP 54.185.50.32.443 > 192.168.4.17.50218: tcp 0
00:40:44.567044 IP 142.250.65.196.443 > 192.168.4.17.64955: UDP, length 1246
00:40:44.567093 IP 142.250.65.196.443 > 192.168.4.17.64955: UDP, length 420
00:40:44.569103 IP 192.168.4.17.64955 > 142.250.65.196.443: UDP, length 36
00:40:44.597629 IP 192.168.4.17.64955 > 142.250.65.196.443: UDP, length 33
00:40:44.597812 IP 142.250.65.196.443 > 192.168.4.17.64955: UDP, length 26
00:40:44.671688 IP 192.168.4.17.64955 > 142.250.65.196.443: UDP, length 33
00:40:44.672143 IP 192.168.4.17.64955 > 142.250.65.196.443: UDP, length 35
00:40:44.672387 IP 192.168.4.17.64955 > 142.250.65.196.443: UDP, length 199
00:40:44.676030 IP 142.250.65.196.443 > 192.168.4.17.64955: UDP, length 30
00:40:44.676351 IP 142.250.65.196.443 > 192.168.4.17.64955: UDP, length 26
00:40:44.676397 IP 142.250.65.196.443 > 192.168.4.17.64955: UDP, length 26
00:40:44.677801 IP 192.168.4.17.64955 > 142.250.65.196.443: UDP, length 33
00:40:44.743407 IP 142.250.65.196.443 > 192.168.4.17.64955: UDP, length 986
00:40:44.743465 IP 142.250.65.196.443 > 192.168.4.17.64955: UDP, length 26
00:40:44.743499 IP 142.250.65.196.443 > 192.168.4.17.64955: UDP, length 248
00:40:44.745578 IP 192.168.4.17.64955 > 142.250.65.196.443: UDP, length 36
00:40:44.745963 IP 192.168.4.17.64955 > 142.250.65.196.443: UDP, length 33
00:40:44.747525 IP 192.168.4.17.62647 > 142.250.65.174.443: UDP, length 1250
00:40:44.747962 IP 192.168.4.17.62647 > 142.250.65.174.443: UDP, length 77
00:40:44.751397 IP 192.168.4.17.62647 > 142.250.65.174.443: UDP, length 332
00:40:44.760792 IP 142.250.65.174.443 > 192.168.4.17.62647: UDP, length 1250
00:40:44.760862 IP 142.250.65.174.443 > 192.168.4.17.62647: UDP, length 622
00:40:44.760898 IP 142.250.65.174.443 > 192.168.4.17.62647: UDP, length 26
00:40:44.761074 IP 142.250.65.174.443 > 192.168.4.17.62647: UDP, length 1246
00:40:44.761135 IP 142.250.65.174.443 > 192.168.4.17.62647: UDP, length 128
00:40:44.763430 IP 192.168.4.17.62647 > 142.250.65.174.443: UDP, length 78
00:40:44.763815 IP 192.168.4.17.62647 > 142.250.65.174.443: UDP, length 33
00:40:44.764064 IP 192.168.4.17.62647 > 142.250.65.174.443: UDP, length 35
00:40:44.768369 IP 142.250.65.174.443 > 192.168.4.17.62647: UDP, length 92
00:40:44.768495 IP 142.250.65.174.443 > 192.168.4.17.62647: UDP, length 25
00:40:44.769934 IP 192.168.4.17.62647 > 142.250.65.174.443: UDP, length 33
00:40:44.773941 IP 192.168.4.17.64955 > 142.250.65.196.443: UDP, length 199
00:40:44.775580 IP 142.250.65.196.443 > 192.168.4.17.64955: UDP, length 26
00:40:44.779367 IP 142.250.65.196.443 > 192.168.4.17.64955: UDP, length 29
00:40:44.807221 IP 192.168.4.17.64955 > 142.250.65.196.443: UDP, length 33
00:40:44.841729 IP 142.250.65.196.443 > 192.168.4.17.64955: UDP, length 987
00:40:44.842500 IP 142.250.65.196.443 > 192.168.4.17.64955: UDP, length 26
00:40:44.842660 IP 142.250.65.196.443 > 192.168.4.17.64955: UDP, length 250
00:40:44.843599 IP 192.168.4.17.64955 > 142.250.65.196.443: UDP, length 36
00:40:44.844603 IP 192.168.4.17.64955 > 142.250.65.196.443: UDP, length 33
00:40:44.851569 IP 192.168.4.17.64955 > 142.250.65.196.443: UDP, length 343
00:40:44.856062 IP 142.250.65.196.443 > 192.168.4.17.64955: UDP, length 29
